{
  "$schema": "http://json-schema.org/draft-07/schema#",
  "$id": "vendor-schema-mapping",
  "title": "VendorSchemaMapping",
  "description": "Configuration blob stored in the schema registry container as '{vendorId}-{schemaVersion}.json'. Defines how a vendor CSV maps to the platform canonical model. Must contain at least one ColumnMapping with canonical_field 'site_id' AND at least one with canonical_field 'timestamp'; absence of either triggers UnknownSchemaException (FR-016, FR-016a).",
  "type": "object",
  "required": ["VendorId", "SchemaVersion", "Delimiter", "ColumnMappings", "RequiredFields"],
  "properties": {
    "VendorId": {
      "type": "string",
      "minLength": 1,
      "description": "Vendor identifier matching the VendorId in DatasetAvailableEvent."
    },
    "SchemaVersion": {
      "type": "string",
      "minLength": 1,
      "description": "Schema version matching the SchemaVersion in DatasetAvailableEvent."
    },
    "Delimiter": {
      "type": "string",
      "enum": [",", ";", "\t"],
      "description": "CSV field delimiter."
    },
    "Encoding": {
      "type": "string",
      "const": "UTF-8",
      "default": "UTF-8",
      "description": "File encoding. Only UTF-8 is accepted."
    },
    "ColumnMappings": {
      "type": "array",
      "minItems": 1,
      "description": "Ordered list of vendor-to-canonical column mapping rules. Must include an entry with CanonicalField='site_id' and an entry with CanonicalField='timestamp'; BlobSchemaRegistry throws UnknownSchemaException if either is absent.",
      "items": {
        "type": "object",
        "required": ["VendorColumn", "CanonicalField", "DataType"],
        "properties": {
          "VendorColumn": {
            "type": "string",
            "minLength": 1,
            "description": "Column name as it appears in the CSV header row (case-insensitive match)."
          },
          "CanonicalField": {
            "type": "string",
            "minLength": 1,
            "description": "Platform canonical field name used in CanonicalRecord.Fields and the Parquet output column."
          },
          "DataType": {
            "type": "string",
            "enum": ["string", "decimal", "double", "float", "int", "integer", "long", "bool", "boolean", "datetime"],
            "description": "Target data type for parsing and Parquet schema generation."
          },
          "UnitConversion": {
            "type": ["string", "null"],
            "enum": ["kw_to_w", "mw_to_w", "kwh_to_wh", "mwh_to_wh", null],
            "description": "Optional unit conversion applied during transformation. Supported: kw_to_w (×1000), mw_to_w (×1000000), kwh_to_wh (×1000), mwh_to_wh (×1000000)."
          },
          "MinValue": {
            "type": ["number", "null"],
            "description": "Optional lower bound for numeric range validation (FR-010). Only evaluated for decimal/double/float. null = no lower bound."
          },
          "MaxValue": {
            "type": ["number", "null"],
            "description": "Optional upper bound for numeric range validation (FR-010). Only evaluated for decimal/double/float. null = no upper bound."
          }
        },
        "additionalProperties": false
      }
    },
    "RequiredFields": {
      "type": "array",
      "description": "List of VendorColumn names that must be non-null and non-empty in every record.",
      "items": {
        "type": "string",
        "minLength": 1
      }
    }
  },
  "additionalProperties": false,
  "examples": [
    {
      "VendorId": "vendor-abc",
      "SchemaVersion": "v2",
      "Delimiter": ",",
      "Encoding": "UTF-8",
      "ColumnMappings": [
        { "VendorColumn": "ts",      "CanonicalField": "timestamp", "DataType": "datetime" },
        { "VendorColumn": "sid",     "CanonicalField": "site_id",   "DataType": "string" },
        { "VendorColumn": "pwr_kw",  "CanonicalField": "power_w",   "DataType": "decimal", "UnitConversion": "kw_to_w", "MinValue": 0, "MaxValue": 5000000 }
      ],
      "RequiredFields": ["ts", "sid"]
    }
  ]
}
